questions,answer1,answer2,answer3,answer4,correctAnswer
A Beach Boys hit was 'California what'?,Girls,Weather,Food,Taxes,1
A chinese burn is usually administered to which part of the body?,Leg,Neck,Arm,Foot,3
A computer game hero is 'Sonic the' what?,Cheetah,Raccoon,Hedgehog,Lizard,3
A 'cuppa' is an informal term for what?,Policeman,Cup of Tea,2p Coin,Smoked Herring,2
A hoot is the cry of which bird?,Canary,Eagle,Goose,Owl,4
A Kiwi is native of which country,Australia,South Africa,New Zealand,Canada,3
A London landmark is what Ben?,Blue,Bull,Bad,Big,4